{
  "product": "Askdo",
  "version": "0.1.5",
  "kits_dir": "./askdo/kits",
  "runs_dir": "./askdo/runs",
  "asset_roots": {
    "kits": [
      "./askdo/kits"
    ],
    "runs": [
      "./askdo/runs"
    ],
    "deliverables": [
      "./askdo/deliverables"
    ]
  },
  "language": {
    "internal_source": "en",
    "kit_source_default": "en",
    "deliverable_default": "en",
    "ask_when_unspecified": true
  },
  "capability_exposure": {
    "public": [
      "askdo-intake",
      "askdo-list-kits",
      "askdo-check",
      "askdo-build-kit",
      "askdo-run-kit",
      "askdo-audit-kit",
      "askdo-level"
    ],
    "internal_keyword_only": [
      "askdo-internal-workshop",
      "askdo-evolve"
    ],
    "maintenance": []
  },
  "ownership": "user-managed",
  "uninstall_policy": "preserve_kits"
}
